{"snapshot_schema_version":"cognitive-runtime.runtime-recovery-snapshot-manifest/v1","storage_schema_version":"1","package_version":"0.0.0","contract_version":"v1","instance_id":"instance-synthetic","authority_revision":"revision-synthetic","state_boundary":{"active_seq":1,"state_view_version":"view-1","checksum":"sha256:0000000000000000000000000000000000000000000000000000000000000000"},"files":[{"path":"authoritative/state-export.cbor","size":128,"checksum":"sha256:2222222222222222222222222222222222222222222222222222222222222222"}],"pending_outbox_summary":{"pending_count":1,"in_flight_count":0},"created_at":"2026-08-11T00:00:05Z","projections_requiring_rebuild":["registry","index"]}
